{
  "name": "upload a file containing a secret",
  "description": "Publishing a detected credential is blocked and the raw value never appears in the result.",
  "input": {
    "action": "upload file",
    "target": "report.txt",
    "context": {
      "metadata": {
        "content": "OPENAI_API_KEY=sk-proj-abcdefghijklmnopqrstuvwxyz123456"
      }
    }
  },
  "expect": {
    "decision": "block",
    "action": "upload",
    "risk": "critical",
    "issues": ["external_publication", "sensitive_data"],
    "forbiddenText": ["sk-proj-abcdefghijklmnopqrstuvwxyz123456"]
  }
}
