{
  "name": "delete a production database backup",
  "description": "Backups require explicit approval and match two destructive database rules.",
  "input": {
    "action": "delete file",
    "target": "production database backup"
  },
  "expect": {
    "decision": "require_approval",
    "action": "delete_file",
    "risk": "critical",
    "issues": ["database_backup"],
    "matchedRules": [
      "ask-before-deleting-database-backups",
      "ask-before-destructive-database-operations"
    ]
  }
}
